{
  "schema_version": "0.1.0-provisional",
  "id": "C02",
  "title": "0605 item 9: the TIN branch code prints three compartments, BIR's own runtime declares five",
  "status": "verified",
  "form": {
    "code": "0605",
    "revision": "1999",
    "bundle_slug": "0605-1999",
    "source_pdf": "0605version1999_09.02.2022_copy.pdf",
    "source_pdf_sha256": "de04419766c59bf27fdeb854c0f7c3f98601900caa20630442e671e2313e536f"
  },
  "subject": {
    "description": "The fourth (branch-code) group of the item-9 'Taxpayer Identification No.' comb chain on page 1. The chain prints 30.24-68.88 / 81.48-121.56 / 134.16-172.68 / 183.00-223.92, separated by three grey (gray 0.7529) filled-and-stroked boxes 12.60 / 12.60 / 10.32pt wide. The caption on this sheet is spelled out as 'Taxpayer Identification No.', not 'TIN'. After the 2026-08-17 sitting the whole chain (not only this box) is reflowed to even 3-3-3-5 inside the original outer span; this printed box remains the PDF identity of the branch group.",
    "page": 1,
    "printed_box_pt": [
      183.0,
      246.12,
      223.92,
      265.08
    ],
    "match": {
      "strategy": "the single element carrying data-field-kind=\"comb\" whose emitted box equals printed_box_pt within tolerance_pt. NOTE, and it is why a tolerance is needed at all here: the emitted box is 40.91pt wide while the printed box measures 40.92pt (183.00 to 223.92), so the right edge differs by 0.01pt. That 0.01pt is recorded, not corrected; this record changes the compartment count only.",
      "tolerance_pt": 0.25,
      "cardinality": "exactly-one"
    },
    "official_field_key": "frm0605:txtBranchCode",
    "cell_id_hint": "p1c29 at HEAD 98ca03c3 — NON-AUTHORITATIVE. Cell ids are quantised bounding boxes (lattice.geometry_subject_key) and renumber on any geometry change; 42 of 146 cited ids in the findings ledger are already dead (PLAN.md risk R2). If the hint and printed_box_pt disagree, printed_box_pt wins and the applier aborts. The applier binds to the batch by the comb element's exact bytes (958 bytes at HEAD 98ca03c3, occurring once), not by the id: a later batch that emits it differently makes the applier refuse rather than guess."
  },
  "preconditions": [
    {
      "check": "sha256 of the pinned source PDF for bundle 0605-1999",
      "expect": "de04419766c59bf27fdeb854c0f7c3f98601900caa20630442e671e2313e536f",
      "note": "The correction is authored against this artwork. A different artwork is a different question. The same digest is recorded in forms/0605-1999/provenance.json."
    },
    {
      "check": "vertical comb ticks printed strictly inside printed_box_pt, measured from that PDF",
      "expect": [
        197.16,
        211.32
      ],
      "note": "Two ticks -> three printed compartments. If BIR's artwork ever gains ticks here, the correction is obsolete and must be retired, not applied."
    },
    {
      "check": "printed ink strictly inside printed_box_pt other than those two ticks",
      "expect": 0,
      "note": "Unlike 2550M, this box pre-prints nothing — no glyph, no bezier '000'. If a later reading finds pre-printed ink here, the emission question changes (emit.py's pre-printed-ink refusal G11) and the record must be re-reviewed."
    },
    {
      "check": "elements in the copied bundle matching subject.match",
      "expect": 1,
      "note": "Zero or more than one aborts the entire applier run. Fail closed."
    },
    {
      "check": "data-comb-slots on the matched element, in the batch being consumed",
      "expect": "3",
      "note": "If a later batch already emits something other than 3 here, the record must be re-reviewed against that batch rather than applied to it."
    },
    {
      "check": "sha256 of forms/0605-1999/index.html in the batch being consumed",
      "expect": "4ed90be390d80516738a32e35a671a0b0e8be6ba2a37d5718ad166c8e7f62e89",
      "note": "232838 bytes at HEAD 98ca03c3. This bundle's provenance.json says it was 'Generated once from the pinned source PDF, then maintained by hand', so the usual assumption that the batch is a pure function of the generator does not hold for it and the file itself is pinned."
    }
  ],
  "what": {
    "operation": "reflow_tin_chain_to_3_3_3_5",
    "from": 3,
    "to": 5,
    "layout_policy": {
      "writing_box": "outer TIN strip unchanged 30.23-223.91 pt; the four groups and three separators are reflowed inside it so every digit cell is the same width (3-3-3-5). The official printed boxes are knocked out with a white rectangle of that same outer span.",
      "division": "separators keep their printed widths (sum 35.49pt) and move with the groups; digit cells equal-split the remaining 158.19pt into 14: [11.3, 11.3, 11.3, 11.3, 11.3, 11.3, 11.29, 11.3, 11.3, 11.3, 11.3, 11.3, 11.3, 11.3]",
      "computed_division_boundaries_pt": [
        0.0,
        8.18,
        16.36,
        24.55,
        32.73,
        40.91
      ],
      "division_sum_pt": 40.91,
      "nominal_pitch_pt": 8.182,
      "declared_pitch_attribute": "8.18",
      "slot_inset": "none — even digit-cell width across the whole strip is the rule; re-applying per-group 0.36pt insets would squeeze the edges of each group and make the last five cells look different from the first nine",
      "computed_slot_lefts_pt": [
        0.38,
        8.18,
        16.36,
        24.55,
        32.73
      ],
      "computed_slot_widths_pt": [
        7.8,
        8.18,
        8.19,
        8.18,
        7.81
      ],
      "slot_widths_sum_pt": 40.16,
      "slot_widths_sum_note": "40.16 = 40.91 - 0.38 - 0.37, which is exactly what the batch's three slots sum to today (13.78 + 14.16 + 12.22 = 40.16). The DIVISION sums to the full 40.91; the writing SURFACES sum to 40.16 because the inherited insets are preserved.",
      "vertical": "unchanged — every slot keeps top 0.75pt, height 17.46pt, and every input keeps class \"fi fh20 fc\"; data-row=\"10\" and data-col=\"29\" are untouched",
      "per_slot_input": "TIN1/2/3: one editable maxlength-1 input per cell. Branch: five editable maxlength-1 inputs, each blank — no value attribute, no readonly, no tabindex override. The branch code is a value the filer supplies on this sheet.",
      "note": "Rounding is fixed here so the applier's output is byte-deterministic and re-computable by hand from the emitted box width alone.",
      "branch_lock": "NOT locked — the official branch box prints no 000 and no ink of any kind inside it. A locked 00000 here would declare the head office on a form whose filer must name a real branch, so the five cells stay editable. Widening 3 (or 4) compartments to 5 is the whole change; nothing is pre-filled.",
      "chrome": "each digit group: one outer 0.72pt frame, white knockout inside. Interior ticks are short bottom hairs (~33% of slot height), matching the official charbox (2550M month v172), not a full-height wall on every digit. Separators: dedicated SVG fill + 0.72pt black frame, no input, not in tab order."
    }
  },
  "reason": "BIR's 1999 artwork for 0605 is CORRECT and OUT OF DATE. It prints three compartments for the TIN branch code — and, unlike 2550M, pre-prints nothing in them. BIR's own eBIRForms client, whose runtime this repository has harvested, declares that same field with max_length 5. No rule can derive 'BIR widened this field after 1999' from 1999 ink, which is precisely why this is a stage-2 correction and not a stage-1 producer bug (ARCHITECTURE.md, 'What belongs in which stage').",
  "authority": {
    "kind": "harvested-runtime-declaration",
    "statement": "BIR eBIRForms HTA runtime declaration (harvested), regulation not identified in-repo.",
    "in_repo_refs": [
      "rules/forms/0605-v2003/fields.json — field_key frm0605:txtBranchCode, constraints.max_length = 5, item_number \"9\", page 1, control_kind \"text\", logical_type \"code\", required \"required\", confidence \"high\", source_refs [\"xml-encrypted-a#decrypted-field:frm0605:txtBranchCode\", \"xml-encrypted-b#decrypted-field:frm0605:txtBranchCode\", \"official-hta-runtime#control:L467\"]",
      "rules/forms/0605-v2003/fields.json — the three TIN segment fields frm0605:txtTIN1 / txtTIN2 / txtTIN3, each constraints.max_length = 3, item_number \"9\", confidence \"high\", source_refs \"official-hta-runtime#control:L464 / L465 / L466\"",
      "rules/forms/0605-v2003/fields.json — form_id 0605-v2003, revision 2003-09-01, field_count 235, runtime_serializable_element_count 235, inventory_sha256 50600e48510a3ea1bbc6c7bf533fbe336c04af7a87700edd503e7a96fa51177d",
      "REVISION GAP, stated rather than hidden: rules/forms/ contains only 0605-v2003. There is no 0605-v1999. The harvested runtime is therefore a LATER revision of the same form than the pinned 1999 artwork this bundle is built from, so a reviewer accepting this record is accepting two things — that the runtime's max_length is authoritative, and that the 2003 declaration governs the field the 1999 sheet prints. The second is the same claim the record already makes ('the artwork is out of date'), but it is not free and is not assumed silently."
    ],
    "regulation_reference": "not identified in-repo — no BIR issuance, revenue regulation or release note in this checkout states when or under what authority the branch code was widened. This record deliberately does NOT cite one. A fabricated citation on a tax form is the worst defect this project could ship; an honest gap is preferred and must stay visible until someone supplies the real issuance.",